pair_id	premise_slo	hypothesis_slo	premise_eng	hypothesis_eng	label
P2472	Poročila o sanjah po prebuditvi iz spanja REM so običajno daljša, bolj čustvena in običajno niso neposredno povezana z našim vsakdanjim življenjem ali dogodki, ki so se nam zgodili pred kratkim.	Sanje, ki jih posameznik sanja med spanjem REM, se razlikujejo po intenzivnosti, dolžini in povezanosti z vsakdanjim življenjem osebe.	Reports of dreams after waking from REM sleep are usually longer, more emotional and usually not directly related to our daily lives or events that have happened recently.	The dreams that a person dreams during REM sleep vary in intensity, length and relevance to the person's daily life.	neutral
P2541	»Tudi sam se strinjam s tem,« se je vmešal še ded Šravf.	Deda Šravf je dejal: »Meni je prav, zaradi mene gremo lahko že jutri na morje.«	I agree with that, Grandpa Šravf interjected.	"Gradnpa Šravf said, ""It's fine by me, I'm the reason we can go to the sea tomorrow."""	neutral
P2545	Vsaj po tem se razlikujem od drugih, ki si jih poznala.	Vsaj hinavska nisem, kot vsi tvoji bivši prijatelji in znanci.	At least that's how I differ from the others you've known.	At least I'm not hypocritical, like all your former friends and acquaintances.	neutral
P2549	S kartico OMV EuroTruck Card lahko vi in vaši vozniki brez gotovine nabavljate gorivo po vsej Evropi.	Vašemu podjetju zelo priporočamo nakup OMV EuroTruck karice, ki vam bo olajšala tranzit preko evropske celine.	With the OMV EuroTruck Card, you and your drivers can buy fuel across Europe without cash.	We highly recommend your company to purchase an OMV EuroTruck to facilitate your transit across the European continent.	neutral
P2599	Največji svetovni izvoznik matičnega mlečka je Kitajska (pridela ga več deset ton na leto), največji potrošnik na svetu pa Japonska.	Kitajski izvoz matičnega mlečka prinaša letno zelo visok dohodek, Japonska ga ne izvaža in zato prihodek dobi drugje.	China is the world's largest exporter of royal jelly (producing tens of tonnes a year) and Japan is the world's largest consumer.	Chinese exports of royal jelly bring in a very high annual income, but Japan does not export it and therefore gets its income elsewhere.	neutral
P2613	Na desno se po večini svojih socialnih in kulturnoantropoloških pogledov uvrščata tradicionalistično konservativni Slovenska ljudska stranka in Nova Slovenija.	Na desni strani parlamenta lahko pričakujemo SLS in NSi, na levi SD in Levico.	On the right, the parties Slovenska ljudska stranka and Nova Slovenija are the most socially and culturally anthropologically conservative parties.	On the right side of the Parliament we can expect SLS and NSi, on the left SD and Levica.	neutral
P2767	S tem sklepom je bilo vprašanje veljavnosti diplom že leta 2008 zaključeno in naknadna vložitev kazenskih ovadb, ki sledi drugim ciljem, nima nikakršnega vpliva in pravnega učinka.	Sklep je kljub dolgotrajnemu procesu uspel leta 2008 doseči pravno veljavnost, z njim pa so bila razrešena tudi vsa vprašanja v zvezi z veljavnostjo diplomskih potrdil, zato kazenske ovadbe niso smiselne.	This decision already closed the issue of the validity of diplomas in 2008 and the subsequent filing of criminal charges pursuing other objectives has no impact and no legal effect.	Despite a lengthy process, the decision was legally valid in 2008 and resolved all issues related to the validity of the diplomas, so there is no point in bringing criminal charges.	neutral
P2811	PREPOVEDANI SO TUDI POSLI ZA RAČUN KOGA TRETJEGA, KAR JE SEVEDA TREBA DOKAZATI.	Posli v poslovnem dialogu se sklepajo med predstavniki strani tudi o takšnih zadevah, ki niso osebne narave.	IT IS ALSO FORBIDDEN TO DO BUSINESS ON BEHALF OF A THIRD PARTY, WHICH MUST, OF COURSE, BE PROVEN.	Business dialogue deals are also concluded between representatives of the parties on matters that are not of a personal nature.	neutral
P2823	Vprašal je, kakšen je bil Heatherin fant, se je spomnila.	Na misel ji je prišlo, da je poizvedoval o lastnostih Heatherinega partnerja.	He asked what Heather's boyfriend was like, she remembered.	It occurred to her that he had made enquiries about the characteristics of Heather's partner.	neutral
P3133	Podrobnejša določila o številu otrok, vključenih v oddelke, določi minister, pristojen za predšolsko vzgojo.	Število otrok v oddelku prvega starostnega obdobja ne sme presegati 12 otrok, v oddelku drugega starostnega obdobja pa 22 otrok.	More detailed rules on the number of children enrolled in the units are set by the minister responsible for early childhood education.	The number of children in a section of the first age group may not exceed 12 children, and the number of children in a section of the second age group may not exceed 22 children.	neutral
P3214	Mislim, da ste tudi novinarji izčrpani na festivalih, prav tako kot sem jaz.	Glasbeni festivali morajo biti, tako kot zame, utrujajoči tudi za vas, novinarje.	I think you journalists are also exhausted by festivals, just like me.	Music festivals must be exhausting for you, journalists, as they are for me.	neutral
P3319	Izvajalci, ki so zaposleni na Univerzi v Mariboru, uredijo potni nalog na svojem matičnem visokošolskem zavodu, stroške si visokošolska zavoda medsebojno poračunata.	Zakon o visokem šolstvu določa tudi pravila glede urejanja potnih nalogov v primeru, da visokošolski delavec dela na več visokošolskih zavodih.	Staff members employed by the University of Maribor shall arrange the travel order at their home higher education institution and the costs shall be settled between the two higher education institutions.	The Higher Education Act also lays down rules on travel orders if a higher education worker works at several higher education institutions.	neutral
P3368	Napetega in mrkega obraza je pogledal Liz, ki si je s prtičkom brisala oči.	Pogled na znano stvar v njenih rokah mu je vzbudil najrazličnejša čustva.	He looked at Liz, who was wiping her eyes with a napkin, her face tense and grim.	The sight of a familiar thing in her hands evoked all sorts of emotions in him.	neutral
P3381	V vročih in soparnih poletnih dneh je vsaka morska osvežitev zelo dobrodošla.	Nekateri trdijo, da vlaga in sopara na počutje ljudi poleti nimata učinka.	On hot and steamy summer days, any sea refreshment is very welcome.	Some argue that humidity and steam have no effect on people's well-being in summer.	neutral
P3412	Življenje na podeželju ima svoje posebnosti, ni enako mestnemu.	Kdor pozimi prebiva na vasi, opazi, da se življenje tam nekoliko razlikuje od mestnega.	Life in the countryside has its own peculiarities, it is not the same as life in the city.	Anyone who lives in the countryside in winter will notice that life there is a little different from life in the city.	neutral
P3451	Tanja je dvignila glavo in ga pogledala s solznimi očmi.	Ko je izvedela za njegovo prevaro, so njene oči zalile solze; namenila mu je očitajoč pogled.	Tanja raised her head and looked at him with teary eyes.	When she learned of his deception, tears welled up in her eyes; she gave him a reproachful look.	neutral
P3472	Langdon je previdno sedel na stol, ki ga je prekrivala slana.	Langdon je v mraku opazil stol, ki je bil zaradi zmrzali prekrit s slano, in počasi sedel.	Langdon sat carefully on a chair covered with frost.	Langdon noticed a chair in the darkness, which was covered in ice from the frost, and slowly sat down.	neutral
P3488	Strokovno ravnanje utemeljuje na osnovi sodobnih teoretičnih izhodišč in praktičnega dela z otroki.	Svoje strokovno ravnanje je argumentiral preko teoretičnih izhodišč najnovejših raziskav in preko lastne prakse dela z najmlajšimi.	He bases his professional conduct on up-to-date theoretical foundations and practical work with children.	He argued his professional conduct on the basis of the theoretical underpinnings of the latest research and his own practice working with young children.	neutral
P3542	Zahvaljujejo se mi za neštete milosti, ki jim jih vsak dan dajem.	Bog je povedal ljudstvu, da se mu verniki vsak dan zahvalijo za vse malenkosti, ki jim jih poklanja.	They thank me for the countless graces I give them every day.	God told the people that the believers thank Him every day for all the little things He bestows on them.	neutral
P3577	Med minerali je klorela bogata z železom in cinkom, vsebuje pa tudi baker, fosfor, kalij, kalcij, magnezij, selen in jod.	Klorela je polnovredno živilo, bogato z vitamini, minerali, antioksidanti, esencialnimi maščobnimi kislinami in polisaharidi.	Among minerals, chlorella is rich in iron and zinc, and also contains copper, phosphorus, potassium, calcium, magnesium, selenium and iodine.	Chlorella is a whole-food rich in vitamins, minerals, antioxidants, essential fatty acids and polysaccharides.	neutral
P3589	Na vozilih je za 12.000 evrov škode, postopek zoper 53-letnega voznika pa sledi.	Vozniku grozi do 7 let zaporne kazni.	The vehicles sustained €12,000 worth of damage and proceedings against the 53-year-old driver are pending.	The driver could face up to 7 years in prison.	neutral
P3644	Klepec si je postavil leseno hišo, za kar je porabil tako debela debla, da so po tri drugo na drugem dala zadosti visoke stene.	Gradnja iz proizvodov narave je zabeležena že v Klepčevi povesti, kjer je stene svojega prebivališča izgradil iz sveže posekanih drevesnih debel.	Klepec built himself a wooden house, using logs so thick that three of them on top of each other gave walls high enough for the house.	Building with the products of nature is already recorded in the story of Klepec, where he built the walls of his dwelling from freshly felled tree trunks.	neutral
P3653	Proti koncu polčasa so rokometašice Dunaferrja izkoristile nekaj nespretnosti in zmanjšale razliko na 11:12.	Kljub slabemu začetku so rokometašice Dunaferrja proti koncu polčasa vendarle uspele izkoristiti nekaj napak nasprotnic in kar 6-krat zapored zatresle njihovo mrežo.	Towards the end of the half, Dunaferr's handball players took advantage of a few slipups and reduced the difference to 11:12.	Despite a poor start, Dunaferr's handball players managed to take advantage of a few mistakes by their opponents towards the end of the half, scoring 6 times in a row.  	neutral
P3665	Le z zakonom oziroma drugim predpisom na podlagi zakona je lahko določen tudi pod 36 ur na teden, in sicer za dela, pri katerih obstajajo večje nevarnosti za poškodbe ali zdravstvene okvare.	Delodajalec lahko zaposli delavca za tvegana dela tudi za manj kot 36 ur tedensko, če mu to dovoljuje zakon.	It can only be set below 36 hours per week by law or by regulation under the law, for work involving a greater risk of injury or ill-health.	An employer can employ a worker for hazardous work for less than 36 hours a week if the law allows it.	neutral
P3722	Nazadnje dodajte žlico olja.	Jed je okusna z oljem ali brez.	Finally, add a tablespoon of oil.	The dish is delicious with or without oil.	neutral
P3728	Številka, ki jo je iskala, je bila prva, ki jo je zagledala.	Imela je srečo, saj je številko, ki jo je imela v mislih, zagledala najprej.	The number she was looking for was the first one she saw.	She was lucky, because she saw the number she had in mind first.	neutral
P3755	»Kdaj pa prideš domov?« ga je še vprašala, ko je končala.	Ko je prenehala pripovedovati zgodbo, mu je še zastavila vprašanje, kdaj se vrne.	When are you coming home? she asked him when she finished.	When she had finished telling him the story, she asked him when he would be back.	neutral
P3784	“No, pa bova torej te dali na stran.”	“Končno sva se odločili: tiste listine gredo na stran.“	Well, we'll put these aside then.	We've finally decided: those papers are going aside.	neutral
P3805	Učenci so se po tem tonu UGLASILI in začeli prepevati.	Učenci glasbene šole so se najprej uglasili s pomočjo klavirja, nato pa zapeli.	After hearing that tone, the students harmonized and started singing.	The music school pupils first warmed up with the piano and then sang.	neutral
P3890	Pogosto ljudje, ki so bili sami ustrahovani, ustrahujejo druge.	Gre za začaran krog, saj nasilje spodbuja nasilje.	Often people who have been bullied themselves bully others.	It is a vicious circle, because violence promotes violence.	neutral
P3897	»Projekt je del programa Ljubljana – svetovna prestolnica knjige 2010«	V času programa Ljubljana - svetovna prestolnica se je zvrstilo kar nekaj projektov.	The project is part of the Ljubljana - World Book Capital 2010 programme	During the Ljubljana - World Capital programme, a number of projects have taken place.	neutral
P3978	Po zelo ugodni ceni lektoriram vse vrste besedil v slovenskem jeziku: seminarske, diplomske, magistrske naloge, časopisne in revialne prispevke ...	Če vaša diplomska, magistrska ali doktorska naloga potrebujejo jezikovni pregled, vam lahko pomagam pri tem po garantirano najnižji ceni na tržišču.	I proofread all types of texts in Slovenian at a very affordable price: term papers, bachelor's and master's theses, newspaper and magazine articles ...	If your bachelor's, master's or doctoral thesis needs a language revision, I can help you with it at the guaranteed lowest price on the market.	neutral
P3991	Eden izmed naslednjih pregovorov pa pravi, da nam blagi januar obeta pozno pomlad.	Pregovori so ustaljeno ubesedene ljudske modrosti, ki večkrat zadevajo tudi vreme in letne čase.	One of the following proverbs says that a mild January promises a late spring.	Proverbs are traditional folk wisdom, often about the weather and the seasons.	neutral
P4010	Pomislil sem, da bi jo lahko ogovoril, če bi ostala.	Če bi ostala samo za trenutek dlje, bi zagotovo pristopil k njej.	I thought that if she had stayed, I could have spoken to her.	If she had stayed just a moment longer, I would certainly have approached her.	neutral
P4037	Oče Tony Richardson je umrl leta 1991 za posledicami aidsa, z ženo pa sta se ločila, ko je imela hčerka štiri leta.	Duhovnik Tony Richardson, ki je po ločitvi od žene in hčerke živel samsko življenje, je umrl zaradi aidsa.	Father Tony Richardson died of AIDS in 1991 and he and his wife divorced when their daughter was four.	Tony Richardson, a priest who lived a single life after separating from his wife and daughter, has died of AIDS.	neutral
P4079	Delovni zvezek 1 je del didaktičnega kompleta za laboratorijsko delo Praktična kemija.	Založba, ki je zasnovala didaktični komplet Praktična kemija, se je odločila, da kupcem v paketu podari še delovni zvezek.	Workbook 1 is part of the Practical Chemistry didactic kit for laboratory work.	The publishing house that designed the Practical Chemistry didactic kit has decided to give customers a workbook as part of the package.	neutral
P4089	Klik deluje 24 ur na dan, vse dni v letu.	Klik je registriranim uporabnikom razpoložljiv vsak trenutek dneva.	Klik works 24 hours a day, every day of the year.	Klik is available to registered users at any time of the day.	neutral
P4128	»Ničesar ne slišim,« je rekel, ko je še močneje napel ušesa.	“Nič ne slišim,” je med zobmi rekel prvemu častniku.	I can't hear anything, he said, straining his ears even harder.	I can't hear anything, he said to the first officer between his teeth.	neutral
P4169	Predlog splošnega dela gozdnogospodarskega načrta območja določi svet Zavoda, predlog splošnega dela gozdnogospodarskega načrta gospodarske enote pa svet območne enote Zavoda.	Območje skupnega pašnika in območja, ki jim je skupni pašnik namenjen, določi upravna enota po predhodnem mnenju kmetijske svetovalne službe.	The proposal for the general part of the forest management plan for the area is determined by the Council of the Institute, and the proposal for the general part of the forest management plan for the economic unit is determined by the Council of the regional unit of the Institute.	The area of the common pasture and the areas to which the common pasture is intended shall be determined by the administrative unit, after prior consultation of the agricultural advisory service.	neutral
P4198	Pogoje za omejitev te pravice vsebuje drugi odstavek 37. člena Ustave.	Njegov odvetnik je jasno povedal, da se da to pravico omejiti, kot piše v 37. členu Ustave.	The conditions for the limitation of this right are contained in Article 37(2) of the Constitution.	His lawyer has made it clear that this right can be limited, as Article 37 of the Constitution states.	neutral
P4217	Tožilcu naj bi tako obljubil denar v zameno za uslugo med postopkom na sodišču, medtem pa naj bi ga prijavil protikorupcijski komisiji, še piše Pomurje.si.	Tožilci se velikokrat znajdejo v položaju, ko jim je ponujena neka vsota denarja, s katero se lahko okoristijo v zameno za protimoralno uslugo, ki lahko vpliva na odločitev sodišča.	He allegedly promised the prosecutor money in exchange for a favour during the court proceedings, and in the meantime reported him to the Anti-Corruption Commission, writes Pomurje.si.	Prosecutors often find themselves in a situation where they are offered a sum of money to profit from in exchange for an anti-moral favour that may influence a court decision.	neutral
P4299	Lahko se dogovorimo, kaj bomo gledali, in se potem o tem tudi pogovorimo.	S skupino si želimo ogledati film.	We can agree what to watch and then discuss it.	We want to watch a film with the group.	neutral
P4341	Jajca dobro razžvrkljamo z rakčevo pasto, soljo in poprom.	Jajca moramo dobro umešati, medtem ko jim dodamo domačo rakčevo pasto.	Whisk the eggs well with the crab paste, salt and pepper.	The eggs must be whisked well while the homemade crab paste is added.	neutral
