pair_id	premise_slo	hypothesis_slo	premise_eng	hypothesis_eng	label
P24	Madžari petih minut prednosti niso izkoristili; slovenski vratar Kristan ni imel veliko dela, v celotni tretjini je moral posredovati le dvakrat.	Madžari pa so na jeseniški turnir poslali pomlajeno zasedbo, v kateri sta bili le prvi peterki iz ekipe, ki je potem na svetovnem prvenstvu izgubila proti Sloveniji z 1:4.	The Macedonians didn't capitalize on their five-minute advantage; Slovenian goalkeeper Kristan didn't have much to do, having to intervene only twice throughout the entire third period.	However, the Hungarians sent a rejuvenated lineup to the tournament in Jesenice, with only the top five players from the team that later lost to Slovenia 1-4 at the World Championship.	neutral
P167	Lutkovna predstava Gledališča Konj je primerna za otroke od 2. leta naprej in traja 30 minut.	V Gledališču konj se vsak dan odvijajo predstave, ki so namenjene tako našim najmlajšim kakor tudi njihovim staršem.	The puppet show by the Konj Theatre is suitable for children from 2 years old and lasts 30 minutes.	The Konj Theatre holds daily performances for our youngest children and their parents.	neutral
P171	»Eee, gospod ...« se je zaslišalo od zadaj.	Kadar koga izza hrbta nagovorimo, moramo biti vljudni.	Uh, sir... could be heard from behind.	When addressing someone from behind their back, we must be polite.	neutral
P252	2. ce je bila v letu 2005 pokojnina njihov edini dohodek, pod pogojem, da od pokojnine ni bila odtegnjena in placana akontacija dohodnine in pri akontaciji dohodnine zavezanci niso uveljavljali posebne olajšave za vzdrzevane druzinske clane.	2. V primeru, da je leta 2005 penzija predstavljala edini vir dohodka in hkrati niso bile uveljavljane nobene posebne olajšave kot npr. ta za VDČ ali otroke s posebnimi potrebami.	2. if the pension was their only income in 2005, provided that no income tax was withheld and paid on the pension and the taxpayers did not claim the special deduction for dependent family members on the income tax deduction.	2. if the pension was the only source of income in 2005 and no special allowances were claimed, such as those for VDČ or children with special needs.	neutral
P299	Če nimam nič, vem, kaj pomeni, če dam na stran 50 evrov.	Imam odličen občutek za varčevanje, saj sem vedno živela zelo skromno.	If I have nothing, I know what it means to put €50 aside.	I have a great sense of austerity, as I have always lived very frugally.	neutral
P301	Vsako nesrečo pri delu, v kateri pride do telesne poškodbe in s tem do nepremoženjske škode, bi moral zavod skrbno obravnavati že zato, da ugotovi vsa odločilna dejstva in zavaruje dokaze za ugotavljanje odškodninskega zahtevka.	V primerih, ko pride do hujše telesne poškodbe pri delu, ki povzroči delno ali popolno invalidnost, zavod odloča o upravičenosti vlagatelja zahtevka za pravično denarno odškodnino.	Any accident at work that results in personal injury and thus non-pecuniary damage should be handled carefully by the institution, in order to at least establish all the relevant facts and to safeguard the evidence for establishing the claim.	In cases of serious occupational injury resulting in partial or total disability, the institution decides whether the claimant is entitled to fair compensation.	neutral
P305	Stroške ocenjevanja in pridobitve DLP-potrdila določi Vlada Republike Slovenije.	Vlada Republike Slovenije se vsako leto trudi znižati stroške izvedbe ocenjevanja in izdaje potrdila DLP.	The costs of the assessment and the acuisition of the DLP certificate are determined by the Government of the Republic of Slovenia.	Every year, the Government of the Republic of Slovenia tries to reduce the costs of the DLP assessment and certification.	neutral
P318	»Nisem pričakovala, da bom srečala ljudi, ki jih poznam.«	Izrazila je svoje nenavdušenje nad srečanjem ljudi, ki jih pozna.	I didn't expect to run into people I know.	She expressed her dislike of running into people she knows.	neutral
P369	Predmet podaja znanja, ki omogočajo osnovno razumevanje delovanja in oblikovanja mehanizmov, s poudarkom na uporabi mehanizmov v industrijski praksi in vsakodnevnem življenju.	Glavni cilj predmeta je študente seznaniti z osnovo teorije delovanja mehanizmov in možnostmi praktične uporabe mehanizmov v industriji in vsakdanu.	The course provides knowledge that enables a basic understanding of the operation and design of mechanisms, with an emphasis on the use of mechanisms in industrial practice and everyday life.	The main aim of the course is to introduce students to the basic theory of how mechanisms work and their practical applications in industry and everyday life.	neutral
P405	»Upam, da me bo pustil pri miru,« se je jezilo samo pri sebi.	Zaradi žalosti si ni želelo nobenih stikov z drugimi.	I hope he'll leave me alone, it muttered to herself in annoyance.	Because of its sadness, it did not want any contact with others.	neutral
P413	Poleg osnovne teme je v njej obravnaval tudi astronomijo, akustiko, sončne ure in vodna kolesa.	Ob ustvarjanju naj bi mu na misel prišla tudi vključitev tematik vesolja, uporabnosti Sonca in vode ter akustika.	In addition to the basic subject matter, it also covered astronomy, acoustics, sundials and water wheels.	While he was creating it the inclusion of themes of space, the utility of the Sun and water, and acoustics purportedly also came to mind.	neutral
P439	»Laci, ti imaš imenitno mamo,« je vzdihnil Uroš.	Laci že dolgo poznam, pred kratkim pa sem spoznal tudi njeno mamo.	Laci, you have a great mother, sighed Uroš.	I've known Laci for a long time, and I recently met her mother as well.	neutral
P443	Če gremo v astralni svet, je izrazito drugačen tudi občutek za prostor.	V svetu duševnosti na čas in prostor gledamo na povsem nov način.	If we delve into the astral world, the sense of space is also distinctly different.	In the world of the psyche, we see time and space in a whole new way.	neutral
P471	PREVLADUJEJO ZLASTI ZNAKI, KI KAŽEJO NA POŠKODBE DIHALNIH ORGANOV IN PREBAVIL.	IZ TEH ZNAKOV ŠE NE MOREMO SKLEPATI, ZA KATERE VRSTE POŠKODBO GRE, POTREBNA JE NADALJNJA TEMELJITA PREISKAVA.	SIGNS INDICATIVE OF DAMAGE TO THE RESPIRATORY AND GASTROINTESTINAL TRACT ARE PARTICULARLY PREVALENT.	THESE SIGNS DO NOT YET INDICATE THE TYPE OF INJURY, FURTHER THOROUGH INVESTIGATION IS NEEDED.	neutral
P488	Pri pripravi razstave so sodelovali številni strokovnjaki, kustosi, metalurgi, strojniki in drugi.	Poleg kustosov so pri razstavi sodelovali strokovnjaki iz različnih strokovnih vej.	Many experts, curators, metallurgists, mechanical engineers and others have been involved in the preparation of the exhibition.	In addition to the curators, the exhibition was curated by experts from various fields of expertise.	neutral
P508	Otroci potrebujejo veliko priložnosti, da govorijo in si izmišljajo zgodbice.	Prav je, da se otroke spodbuja h grajenju njihovih govornih sposobnosti in domišljije.	Children need lots of opportunities to talk and make up stories.	It is right to encourage children to build their speaking skills and imagination.	neutral
P516	Izza verig potujoče vate je pokukalo sonce in škofa opremilo s svetniškim sijem.	Sončni žarki so pokukali izza verig potujoče vate in obsijali škofa.	The sun peeked out from behind the chains of the wandering cotton wool and gave the bishop a saintly glow.	The sun's rays peeked out from behind the chains of the travelling cotton wool and shone on the bishop.	neutral
P593	Nekega dne pa se je krepak mlad fant iz okolice gradu vseeno opogumil.	Nekoč se je fantič, ki je prebival ob gradu, odločil, da se ne bo več bal.	But one day, a strapping young lad from the castle's surroundings took heart.	Once upon a time, a boy who lived by the castle decided to stop being afraid.	neutral
P602	- enega predstavnika za področje zdravstva volijo poklicne organizacije zdravstvenih delavcev in zdravstvenih sodelavcev,	Osebo, ki predstavlja področje zdravstva, imenujejo zaposleni v zdravstvu.	- one health representative is elected by the professional organisations of health workers and allied health professionals,	The person who represents the health sector is called the health worker.	neutral
P621	Ko sem ovdovela, sem bila v težavah in sem morala revijo odpovedati.	Takoj po pogrebu sem sklenila spremeniti svoje življenje, zato sem odšla v Tibet.	When I was widowed, I was in trouble and had to cancel the magazine.	Immediately after the funeral, I decided to change my life, so I went to Tibet.	neutral
P654	Sam pri sebi se je zahihital, pogledal v ogledalo in si poravnal kravato.	Po tihem se je zahihital, preden se je obrnil k zrcalu in si zgledil in popravil kravato.	He chuckled to himself, looked in the mirror and straightened his tie.	He chuckled quietly before turning to the mirror to look at himself and fix his tie.	neutral
P711	Dodali smo tudi multimedijske vsebine, kot so video prezentacije, animacije, zvočne aplikacije, ki bodo nadgradile vsebinski del igre in omogočile posebno doživljajsko izkušnjo.	Ukvarjamo se z dodajanjem novih multimedijskih vsebin, med katere prištevamo video predstavitve, animacije in zvočne aplikacije, prav tako pa nas zanima tudi vsebinski del igre in ustvarjanje posebnega doživetja ob igranju.	We have also added multimedia content, such as video presentations, animations, and audio applications, which will enhance the content of the game and provide a special immersive experience.	We are working on adding new multimedia content, including video presentations, animations, and audio applications, but we are also interested in the content part of the game and in creating a special gaming experience.	neutral
P767	Nekateri od njih so močno specializirani, drugi so bolj splošnonamenski.	Kadar gre za različne narave izdelkov, se pojavljajo tudi različne potrebe o njih.	Some of them are highly specialised, others are more general-purpose.	When it comes to different types of products, there are also different needs about them.	neutral
P817	Rodilo se je 8 otruok: pet puobčju an tri čičice, kar je zaries puno!	Letos je luč sveta uzrlo kar osem detet, pet moškega ter tri ženskega spola.	8 babies were born: five boys and three girls, which is a lot!	This year, eight babies have been born, five male and three female.	neutral
P1034	Bila je namreč edino vrhnje oblačilo, ki sem ga imela.«	Ni imela prevelike izbire, saj je bila jopica, ki jo je držala, njeno edino vrhnje oblačilo.	"It was the only outerwear I had."""	She didn't have much choice, as the cardigan she was holding was her only outerwear.	neutral
P1221	Za nobenega ne bi mogel človek reči, da je popolnoma trezen.	Iz njihovega obnašanja se je takoj razbralo, da so bli vsaj rahlo vinjeni.	No one could be said to be completely sober.	It was immediately clear from their behaviour that they were at least a little tipsy.	neutral
P1256	Vzorca si v vrsti izmenično sledita po vsej dolžini modela.	Vzorca sta si med seboj čisto podobna, še vrsti imata enako razporejeni.	The patterns alternate in a row along the length of the model.	The patterns are quite similar, even the order of rows is equal in both of them.	neutral
P1271	Vpliv na kakovost in učinkovitost gimnazijskega izobraževanja Splošna matura spodbuja dijake, učitelje in šole k doseganju večje učinkovitosti pouka in učenja ter višje kakovosti znanja.	Ne glede na neizpodbiten strašljiv preizkus znanja, ki čaka vsakega tako ali drugače nadobudnega dijaka, se v razredu pojavljajo t. i. prvaki, ki sotrpine spodbujajo k vzajemnemu kolektivnemu izostanku od pouka.	Impact on the quality and efficiency of grammar school education The General Baccalaureate exam encourages students, teachers and schools to achieve more efficient teaching and learning and a higher quality of knowledge.	Notwithstanding the undeniably terrifying test of knowledge that awaits every student of one ability or another, there are so-called champions in the classroom who encourage their classmates to collectively skip class together.	neutral
P1340	Gomolji so dolgo ovalni, z gladko rumeno kožico in svetlo rumenim mesom.	Občutljiv je na plesen na listih, manj na plesen na gomoljih.	The tubers are long, oval, with smooth yellow skin and light yellow flesh.	It is sensitive to leaf blight, less to tuber blight.	neutral
P1442	Oksidacijske in redukcijske reakcije vedno potekajo sočasno. • Reakcije oksidacije potekajo pri katabolizmu, kjer se zapletene spojine razgradijo v enostavnejše produkte.	Reakcije oksidacije in redukcije potekajo hkrati, pri oksidaciji, ki jo zlahka opazimo pri pojavih v naravi, gre za razgradnjo spojin na enostavnejše dele.	Oxidation and reduction reactions always take place simultaneously. - Oxidation reactions take place during catabolism, where complex compounds are broken down into simpler products.	Oxidation and reduction reactions occur simultaneously, and oxidation, which is easily observed in nature, involves the breakdown of compounds into simpler parts.	neutral
P1465	Prepovedani so vsakršna reprodukcija, distribucija, predelava in dajanje avtorskih del ali njihovih delov na voljo javnosti v tržne namene brez sklenitve ustrezne pogodbe s podjetjem Nova obzorja založništvo d.o.o.	Avtorske pravice spadajo med pravice intelektualne lastnine, so izključne narave in omejujejo uporabo avtorskega dela brez soglasja avtorja, za prenos avtorskih pravic pa morata stranki podpisati avtorsko pogodbo.	Any reproduction, distribution, modification and making available to the public for commercial purposes of the copyright works or parts thereof without the conclusion of an appropriate contract with Nova obzorja založništvo d.o.o. is prohibited.	Copyright is an intellectual property right, is exclusive and restricts the use of a copyright work without the author's consent, and requires the parties to sign a copyright agreement to transfer the copyright.	neutral
P1466	Jaz zgoraj, ampak si narediva tako, da je vedno dobro.	Zgoraj stanujem jaz, se pa trudiva, da bi nama bilo dobro.	I'm upstairs, but we make it so it's always good.	I live upstairs, but we are trying to make it work.	neutral
P1472	Nabiramo cvetoče zelišče, ki ga posušimo in uporabljamo za poparke, medtem ko liste in cvetove uporabljamo kot zelenjavo, predvsem za solate.	Zelišča so v kuhinji zelo uporabna, saj jih lahko porabimo sveža kar takoj, lahko pa jih posušimo in shranimo, tako da so primerna za uporabo še celo leto.	The flowering herb is harvested, dried and used for infusions, while the leaves and flowers are used as vegetables, especially in salads.	Herbs are very useful in the kitchen because they can be eaten fresh right away, or dried and stored so they can be used all year round.	neutral
P1486	V letošnjem letu pa se pričakuje nov Družinski zakonik, ki naj bi natančno opredelil pristojnosti za odločanje v družinsko pravnih zadevah.	Za odločanje o zadevah iz Družinskega zakonika, za katere so po tem zakoniku pristojna sodišča, so na prvi stopnji stvarno pristojna okrožna sodišča.	A new Family Code is expected later this year, which should define the precise jurisdictions for deciding family law matters.	To decide on matters under the Family Code that fall within the jurisdiction of the courts under this code, the district courts have jurisdiction in the first instance.	neutral
P1532	Po izpisu osebnih podatkov vlagatelja na vlogo za izdajo osebne izkaznice jih vlagatelj pregleda, še preden se vloga pošlje v izdelavo osebne izkaznice.	Izdaja osebne izkaznice poteka tako, da vlagatelj izpolni vlogo za izdajo osebnega dokumenta ter počaka na izdelano kartico.	After the applicant's personal data has been extracted from the ID card application, it is checked by the applicant before the application is sent for the production of the ID card.	The ID card is issued by the applicant filling in an application form and waiting for the card to be produced.	neutral
P1537	“Nobenega razloga ni bilo,“ je odgovoril princ.	Princ je potrto pripomnil, da za to ni bilo dobrega razloga.	There was no reason, replied the Prince.	The Prince remarked dejectedly that there was no good reason for this.	neutral
P1602	Tek mi prinaša notranje zadovoljstvo, pomirja me in mi daje elan ter novih moči, na kratko, postal je moj slog življenja.	Po novem zelo pogosto tečem, kar mi prinaša veliko zadovoljstva in name tudi drugače pozitivno vpliva.	Running brings me inner satisfaction, it calms me down and gives me vigour and new strength - in short, it has become my way of life.	I am now running very often, which gives me a lot of satisfaction and has other positive effects on me.	neutral
P1615	Depresivni bolniki se pogosto prebujajo prezgodaj ali sredi noči in ne morejo več zaspati.	Depresija ima na dolgi rok negativen vpliv na potek spalnega ritma, njegovo dolžino in zmožnost nočnega spanja.	Depressed patients often wake up too early or in the middle of the night and can no longer fall asleep.	Depression has a long-term negative impact on sleep rhythms, sleep duration and the ability to sleep at night.	neutral
P1651	Revija Sopotnik je namenjena potnikom, ki potujejo z vlaki Slovenskih železnic.	Za preganjanje dolgčasa potnikov so v vlake SŽ namestili revijo Sopotnik.	The Sopotnik magazine is aimed at passengers travelling on Slovenian Railways trains.	To help passengers kill boredom, SŽ trains have been equipped with Sopotnik magazine.	neutral
P1669	Pomoč staršev pri razvoju bralnih spretnosti je torej vezana predvsem na prva leta šolanja.	Otrokova zgodnja faza v razvoju bralnih sposobnosti se razvija tudi pod vplivom interakcije s starši.	Parental support for the development of reading skills is therefore mainly linked to the early years of schooling.	A child's early stage in the development of reading skills is also influenced by interaction with parents.	neutral
P1693	Nato nenadoma zaslišimo šumenje in žoburenje -- glas pravljičnega zmaja.	Iz gozda je prilomastil zmaj, pod njegovimi nogami je šumelo listje in pljuskal potok.	Then suddenly we hear a rustling and a murmuring-- the voice of the fairy dragon.	A dragon came out of the woods, leaves rustling and a stream splashing beneath his feet.	neutral
P1732	Takšnega so me torej videli: ožganega od sonca, z razmršeno grivo in z brado, pristriženo s sulico, s starikavim in negotovim spolom pod opasnikom, z mojimi starimi čevlji in mojim izgubljenim jezikom.	Takšen sem bil: zagorel, oguljen in neurejen ter star, hodil sem z veslom na rami, obut sem bil v prastare pošvedrane čevlje, bil sem bolj tih, kos blaga, ki mi je zakrival mednožje, pa je bil že star in umazan.	So that's how they saw me: sunburnt, with a dishevelled mane and a beard trimmed with a spear, with an aged and uncertain gender under my belt, with my old shoes and my lost tongue.	That's what I was: tanned, shabby, dishevelled and old, walking with a paddle on my shoulder, wearing old, run-down heels, I was a quite type and the piece of fabric that was covering my private parts was old and dirty.	neutral
P1737	Kljub temu pa tako opredeljeno vseživljenjsko učenje in izobraževanje ne obsega celotnega človekovega življenja.	Vseživljenjsko učenje in izobraževanje kljub splošnemu prepričanju ljudi ne more obsegati celotnega življenja, le avtonomno izbrana obdobja.	However, lifelong learning and education defined in this way does not cover the whole of a person's life.	Despite popular belief, lifelong learning and education cannot encompass the whole of life, but only autonomously selected periods.	neutral
P1745	Kot fusion-scission se šteje tudi operacija, pri kateri prenosna družba del svojega premoženja »združi« s celotnim premoženjem druge delujoče družbe.	Fusion-scission je termin, ki se uporablja v primeru, ko prenosna družba 50 % delež svojega premoženja spoji s kompletnim premoženjem druge aktivne družbe.	"A fusion-scission is also an operation in which a transferring company ""fuses"" part of its assets with the entire assets of another operating company."	Fusion-scission is the term used when a transferring company combines 50% of its assets with the entire assets of another active company.	neutral
P1799	Če uveljavlja tožeča stranka v tožbi zoper isto toženo stranko več zahtevkov, ki se opirajo na isto dejansko in pravno podlago, se določi pristojnost po seštevku vrednosti vseh zahtevkov.	Da ne prihaja do prevelikih zamud, so sodišča odločila, da pristojnost vseh zahtevkov tožeče stranke proti isti osebi določajo s seštevkom vrednosti vseh zahtevkov.	If the claimant brings several claims against the same defendant, based on the same factual and legal basis, jurisdiction shall be determined by adding up the value of all the claims.	To avoid excessive delays, the courts have decided to determine the jurisdiction of all claims brought by the claimant against the same person by adding up the value of all the claims.	neutral
P1833	Če je ta čas krajši od izrečene kazni, lahko sodišče odredi, da mora obsojenec prestati ostanek kazni, ali da naj bo izpuščen na pogojni odpust.	Vrhovno sodišče lahko v določenih primerih odloča, ali bo obsojenec v zaporu preživel celoten čas kazni ali bo šel pod posebnimi pogoji na prostost.	If this time is shorter than the imposed penalty, the court may order that the convicted person serves the remainder of the sentence or be released on parole.	In certain cases, the Supreme Court can decide whether a convicted person will spend the whole of his or her sentence in prison, or whether he or she will be released under special conditions.	neutral
P1852	Posodo pokrijemo in zelenjavo dušimo na močni vročini 8 minut oziroma tako dolgo, da se zmehča.	Mešanico zelenjave v posodi, ki je primerna za segrevanje, toplotno obdelujemo tako dolgo, da ni več surova.	Cover the pan and sauté the vegetables over a high heat for 8 minutes, or until tender.	Heat the vegetable mixture in a heat-safe container until it is no longer raw.	neutral
P2052	“Lady Mayfieldova, ne vem, kako naj vam to povem, ampak ...“	“Lady Mayfield, povedati vam moram neprijetno novico ...“	Lady Mayfield, I don't know how to tell you this, but ...	Lady Mayfield, I have some unpleasant news to tell you...	neutral
P2081	Leta 2008 je Matej Stare zasedel šesto, Jure Kocjan pa osmo mesto v skupnem seštevku.	Naša odlična kolesarja Matej Stare in Jure Kocjan sta po odlični sezoni zasedla šesto in osmo mesto.	In 2008, Matej Stare and Jure Kocjan finished sixth and eighth in the overall standings, respectively.	After a great season, our two excellent riders Matej Stare and Jure Kocjan came in sixth and eighth place, respectively.	neutral
P2126	Suho in toplo spomladansko vreme je bilo kot nalašč za razvoj škodljivcev.	Zaradi ugodnih vremenskih razmer se je spomladi razvilo več kot 10 novih vrst škodljivcev.	The dry and warm spring weather was perfect for pest development.	More than 10 new pest species developed in spring due to favourable weather conditions.	neutral
P2150	Skice prikazujejo smer vrtenja Zemlje (Z) in smer kroženja Lune (L) okrog Zemlje.	Luna je Zemljin naravni satelit, zato je na skici tudi narisana.	The sketches show the direction of the Earth's rotation (E) and the direction of the Moon's orbital motion (M) around the Earth.	The Moon is the Earth's natural satellite, which is why it is drawn on the sketch.	neutral
P2216	Na levem kraju je bel lanen trak za zavezovanje, na desnem je odtrgan.”	Beli laneni trak lahko vsak odtrga in odnese domov, nekdo ga je vzel le z desnega kraja.	"On the left is a white linen ribbon, on the right it is torn off."""	Anyone can tear off the white linen ribbon and take it home, but someone took it off only from the right end.	neutral
P2289	“Je kdo doma?“ je vprašal Ray, a ne preglasno.	“Je kdo doma?“ je previdno vprašal Ray, upajoč, da je hiša prazna.	Is anyone home? Ray asked, but not too loudly.	Is anyone home? Ray asked cautiously, hoping the house was empty.	neutral
P2328	Slovensko stalno gledališče vabi na predstavitev repertoarja za sezono 2010-2011	Repertoar za sezono 2010-2011 gledališča v Trstu bo kmalu znan.	The Slovenian Permanent Theatre invites you to the presentation of the repertoire for the 2010-2011 season	The repertoire for the 2010-2011 season of the theatre in Trieste will be announced soon.	neutral
P2352	Ana je 15-letno komunikativno in splošno razgledano dekle.	O izobraženosti Ane, ki jih šteje 15, ni dvoma, o osebnosti pa so različnih mnenj.	Ana is a 15-year-old communicative and well-read girl.	There is no doubt about Ana's education, who is 15 years of age, but there are different opinions about her personality.	neutral
P2370	Tik pred serviranjem kruhke okrasimo še z rezinami svežega paradižnika in zelenim peteršiIjem.	Za okusnost jedi je pomemben njen izgled, zato tudi kruhke pred postrežbo okrasimo.	Right before serving, garnish the bread slices with fresh tomato slices and green parsley.	The appearance of a dish is important for its tastiness, so the bread slices should be decorated before serving.	neutral
P2427	Dostop do prostorov za pridržanje CPL je preko parkirnega prostora mimo PP Ljubljana Moste z intervencijskim vozilom.	Poskrbljeno je, da intervencijska vozila lahko dostopajo do prostorov za pridržanje CPL.	Access to the CPL detention facilities is via the parking area past PP Ljubljana Moste with an intervention vehicle.	Arrangements are made for intervention vehicles to access CPL detention facilities.	neutral
